{
  "@context": "../../../context/development/phyx.json",
  "phylogenies": [
    {
      "newick": "(Parasuchia,(rauisuchians,Aetosauria,(sphenosuchians,(protosuchians,(mesosuchians,(Hylaeochampsa,Aegyptosuchus,Stomatosuchus,(Allodaposuchus,('Gavialis gangeticus',(('Diplocynodon ratelii',('Alligator mississippiensis','Caiman crocodilus')Alligatoridae)Alligatoroidea,('Tomistoma schlegelii',('Osteolaemus tetraspis','Crocodylus niloticus')Crocodylinae)Crocodylidae)Brevirostres)Crocodylia))Eusuchia)Mesoeucrocodylia)Crocodyliformes)Crocodylomorpha))root;",
      "label": "Fig 1 from Brochu 2003",
      "@id": "#phylogeny0",
      "source": {
        "type": "article",
        "title": "Phylogenetic approaches toward crocodylian history",
        "authors": [
          {
            "name": "Christopher A. Brochu",
            "alternate": ["Brochu, Christopher A."],
            "firstname": "Christopher",
            "middlename": "A.",
            "lastname": "Brochu"
          }
        ],
        "year": 2003,
        "figure": "1",
        "identifier": [
          {
            "type": "doi",
            "id": "10.1146/annurev.earth.31.100901.141308"
          }
        ],
        "link": [
          {
            "url": "https://www.annualreviews.org/doi/10.1146/annurev.earth.31.100901.141308"
          }
        ],
        "journal": {
          "name": "Annual Review of Earth and Planetary Sciences",
          "volume": "31",
          "pages": "357--397",
          "identifier": [
            {
              "type": "eISSN",
              "id": "1545-4495"
            }
          ]
        }
      }
    }
  ],
  "phylorefs": [
    {
      "label": "Alligatoridae",
      "phylorefType": "phyloref:PhyloreferenceUsingMinimumClade",
      "definition": "Alligatoridae (Cuvier 1807).\n\nLast common ancestor of Alligator mississippiensis and Caiman crocodilus and all of its descendents.",
      "definitionSource": {
        "type": "article",
        "title": "Phylogenetic approaches toward crocodylian history",
        "authors": [
          {
            "name": "Christopher A. Brochu",
            "alternate": ["Brochu, Christopher A."],
            "firstname": "Christopher",
            "middlename": "A.",
            "lastname": "Brochu"
          }
        ],
        "year": 2003,
        "figure": "1",
        "identifier": [
          {
            "type": "doi",
            "id": "10.1146/annurev.earth.31.100901.141308"
          }
        ],
        "link": [
          {
            "url": "https://www.annualreviews.org/doi/10.1146/annurev.earth.31.100901.141308"
          }
        ],
        "journal": {
          "name": "Annual Review of Earth and Planetary Sciences",
          "volume": "31",
          "pages": "357--397",
          "identifier": [
            {
              "type": "eISSN",
              "id": "1545-4495"
            }
          ]
        }
      },
      "internalSpecifiers": [
        {
          "@type": "http://rs.tdwg.org/ontology/voc/TaxonConcept#TaxonConcept",
          "hasName": {
            "@type": "http://rs.tdwg.org/ontology/voc/TaxonName#TaxonName",
            "label": "Caiman crocodilus",
            "nameComplete": "Caiman crocodilus",
            "genusPart": "Caiman",
            "specificEpithet": "crocodilus"
          }
        },
        {
          "@type": "http://rs.tdwg.org/ontology/voc/TaxonConcept#TaxonConcept",
          "hasName": {
            "@type": "http://rs.tdwg.org/ontology/voc/TaxonName#TaxonName",
            "label": "Alligator mississippiensis",
            "nameComplete": "Alligator mississippiensis",
            "genusPart": "Alligator",
            "specificEpithet": "mississippiensis"
          },
          "label": "Alligator mississippiensis"
        }
      ],
      "externalSpecifiers": []
    }
  ],
  "defaultNomenclaturalCodeIRI": "http://rs.tdwg.org/ontology/voc/TaxonName#ICZN"
}
